{
 "dataset": "Reported flood depths at named places in Mae Sai district, 10-13 Sep 2024 (Thai and English news, paraphrased)",
 "dataset_th": "ความลึกของน้ำท่วมตามรายงานข่าว ณ สถานที่ที่ระบุชื่อในอำเภอแม่สาย 10–13 ก.ย. 2567 (2024) (ข่าวภาษาไทยและอังกฤษ เรียบเรียงใหม่)",
 "schema_id": "https://floodguard.th/contracts/reported-depths-2024.schema.json",
 "compiled": "2026-10-03",
 "compiled_by": "FloodGuard desk research of Thai and English news (roadmap C-2), read by a second checker whose corrections are applied; locations from OpenStreetMap (Nominatim) and place listings.",
 "status": "reported (anecdotal, not surveyed)",
 "status_th": "ตามรายงาน (คำบอกเล่า ไม่ได้สำรวจ)",
 "source_timestamp": "reports published 2024-09-10T05:32+07:00/2024-09-13T11:32+07:00; compiled 2026-10-03",
 "confidence": "low",
 "confidence_reason": "Anecdotal news reports, not surveys: depths are lower bounds, ranges or body and storey references, several statements cover more than one community, times are article times rather than measurement times, and most locations are community or street points.",
 "use_rule": "A consistency check only. The reported depths are never used to tune the model: no keyframe, depth-factor or terrain change may be set from them.",
 "licence_note": "Facts with citations. Each report is paraphrased in the project's own words; only the article title is quoted, as a citation. Coordinates matched to OpenStreetMap stay under ODbL 1.0.",
 "copyright_rule": "Paraphrase only: no sentence of an article is copied, a title is cited at most once per report and is no longer than 160 characters, and a record carries at most one quoted phrase of under 15 words per source.",
 "location_rule": "A point is given only where the location confidence is medium or high. location_tolerance_m is how far the reported spot may lie from the point, read from the location basis.",
 "time_rule": "Each report has a window in local time (ICT, UTC+7). It ends at the article's time stamp, because a report cannot describe a later moment, and starts at the earliest time the text allows.",
 "depth_rule": "Numbers are kept as the source gives them: a lower bound (more than 1 m) or a range (2-3 m in places, whose lower end is the lower bound). A storey or body reference is kept as a class and never turned into a number.",
 "assumptions": [
  "The depths are what reporters and residents said, not measurements; none was surveyed or checked on the ground.",
  "A statement that names several communities is recorded once per community, with the same depth, time and source and a note that it is shared. Counts are given per place record and, separately, once per statement.",
  "Community and street points are centroids of mapped streets or a nearby landmark; the reported spot may lie up to the record's location tolerance away.",
  "Reports of other floods (August and early October 2024, 2025, 2022) and of places outside Mae Sai district are left out."
 ],
 "assumptions_th": [
  "ความลึกเป็นคำบอกเล่าของผู้สื่อข่าวและผู้อยู่อาศัย ไม่ใช่ค่าที่วัดได้ ไม่มีรายการใดได้รับการสำรวจหรือตรวจดูในพื้นที่",
  "ข้อความที่กล่าวถึงหลายชุมชนบันทึกแยกเป็นหนึ่งรายการต่อหนึ่งชุมชน โดยใช้ความลึก เวลา และแหล่งข่าวเดียวกัน พร้อมหมายเหตุว่าเป็นข้อความร่วม ตัวเลขสรุปนับแบบรายรายการตามสถานที่ และแยกนับแบบหนึ่งครั้งต่อหนึ่งข้อความ",
  "จุดของชุมชนและถนนคือจุดกึ่งกลางของถนนในแผนที่หรือสถานที่สำคัญใกล้เคียง จุดที่รายงานอาจห่างออกไปได้ถึงระยะคลาดเคลื่อนของตำแหน่งของรายการนั้น",
  "ไม่นับรายงานน้ำท่วมครั้งอื่น (สิงหาคมและต้นตุลาคม 2567 (2024), ปี 2568 (2025) และปี 2565 (2022)) และรายงานของสถานที่นอกอำเภอแม่สาย"
 ],
 "depth_classes": [
  {
   "id": "waist_deep",
   "label": {
    "en": "waist-deep (or more)",
    "th": "ระดับเอว (หรือมากกว่า)"
   }
  },
  {
   "id": "chest_deep",
   "label": {
    "en": "chest-deep",
    "th": "ระดับอก"
   }
  },
  {
   "id": "neck_deep",
   "label": {
    "en": "neck-deep",
    "th": "ระดับคอ"
   }
  },
  {
   "id": "over_head",
   "label": {
    "en": "over head height",
    "th": "สูงเกินศีรษะ"
   }
  },
  {
   "id": "ground_floor_submerged",
   "label": {
    "en": "ground floor under water",
    "th": "ชั้นล่างจมน้ำทั้งชั้น"
   }
  },
  {
   "id": "above_ground_floor",
   "label": {
    "en": "above the ground floor (second floor reached)",
    "th": "สูงกว่าชั้นล่าง (ถึงชั้นสอง)"
   }
  },
  {
   "id": "roof_level_refuge",
   "label": {
    "en": "roof-level refuge",
    "th": "ต้องหนีขึ้นหลังคา"
   }
  },
  {
   "id": "not_stated",
   "label": {
    "en": "depth not stated",
    "th": "ไม่ระบุความลึก"
   }
  }
 ],
 "reports": [
  {
   "id": "ms-c2-01",
   "statement_id": "ms-c2-01",
   "place": {
    "en": "Sai Lom Joy border market",
    "th": "ตลาดสายลมจอย"
   },
   "tambon": {
    "en": "Wiang Phang Kham",
    "th": "เวียงพางคำ"
   },
   "tambon_note": null,
   "point": {
    "lat": 20.4441,
    "lon": 99.8791
   },
   "location_confidence": "medium",
   "location_tolerance_m": 150,
   "location_basis": "Point from a place listing found by web search (20.44408, 99.87907). The listing's plus code CVVJ+H5R decodes to about 20.4440, 99.8804, some 130 m east, which matches a second listing (20.44399, 99.88039). Both fall on the riverside market strip by the U-turn bridge north of the Friendship Bridge 1 checkpoint (OpenStreetMap bridge at 20.4447, 99.8804); the first point is kept, so allow about 150 m.",
   "depth": {
    "kind": "lower_bound",
    "lower_bound_m": 1.0,
    "upper_m": null,
    "class": null,
    "statement": {
     "en": "Thansettakij reports Sai River water spreading into the market area to more than 1 m deep (lower bound) after heavy rain.",
     "th": "ฐานเศรษฐกิจรายงานว่าน้ำจากแม่น้ำสายไหลเข้ามาในย่านตลาด ลึกเกิน 1 ม. (ค่าขั้นต่ำ) หลังฝนตกหนัก"
    }
   },
   "source_kind": "eyewitness_or_journalist",
   "time": {
    "text": {
     "en": "Early morning of 10 Sep 2024 (article time-stamped 05:32 ICT)",
     "th": "เช้ามืดวันที่ 10 ก.ย. 2567 (2024) (ข่าวลงเวลา 05:32 น.)"
    },
    "window_start": "2024-09-10T00:00:00+07:00",
    "window_end": "2024-09-10T05:32:00+07:00",
    "window_basis": "The window runs from the start of the day the report describes to the article's time stamp."
   },
   "event_date_basis": "The article is dated 10 Sep 2024 and describes flooding under way after rain that began on 8 Sep.",
   "source": {
    "title": "พายุยางิพ่นพิษ เชียงรายฝนตกหนัก น้ำท่วมแม่สายตลาดสายลมจอย",
    "publisher": "Thansettakij (ฐานเศรษฐกิจ)",
    "url": "https://www.thansettakij.com/news/general-news/606236",
    "published": "2024-09-10T05:32:00+07:00",
    "language": "th"
   },
   "checker_corrections": "The plus code decodes about 130 m east of the given point; both points lie on the market strip, so medium confidence holds and the basis now says so. The article says the water spread into the area rather than that the river overflowed its banks. The Khaosod English figure was seen only in a search summary and the Bangkok Insight one was not checked, so both are left out."
  },
  {
   "id": "ms-c2-02",
   "statement_id": "ms-c2-02",
   "place": {
    "en": "Sai Lom Joy border market (Mae Sai trading area)",
    "th": "ตลาดสายลมจอย ย่านการค้าในเมืองแม่สาย"
   },
   "tambon": {
    "en": "Wiang Phang Kham",
    "th": "เวียงพางคำ"
   },
   "tambon_note": null,
   "point": {
    "lat": 20.4441,
    "lon": 99.8791
   },
   "location_confidence": "medium",
   "location_tolerance_m": 150,
   "location_basis": "Same market point as ms-c2-01. Point from a place listing found by web search (20.44408, 99.87907). The listing's plus code CVVJ+H5R decodes to about 20.4440, 99.8804, some 130 m east, which matches a second listing (20.44399, 99.88039). Both fall on the riverside market strip by the U-turn bridge north of the Friendship Bridge 1 checkpoint (OpenStreetMap bridge at 20.4447, 99.8804); the first point is kept, so allow about 150 m.",
   "depth": {
    "kind": "lower_bound",
    "lower_bound_m": 2.0,
    "upper_m": null,
    "class": null,
    "statement": {
     "en": "A Thai PBS reporter describes the Sai Lom Joy trading area under more than 2 m of water (lower bound), with a fast current in several riverside communities and river water reaching Phahonyothin Road at the Doi Wao market entrance for the first time (no depth given for the road).",
     "th": "ผู้สื่อข่าวไทยพีบีเอสระบุว่าย่านการค้าสายลมจอยมีน้ำลึกเกิน 2 ม. (ค่าขั้นต่ำ) หลายชุมชนริมน้ำมีกระแสน้ำไหลแรง และน้ำจากแม่น้ำขึ้นถึงถนนพหลโยธินหน้าทางเข้าตลาดดอยเวาเป็นครั้งแรก (ไม่ระบุความลึกบนถนน)"
    }
   },
   "source_kind": "eyewitness_or_journalist",
   "time": {
    "text": {
     "en": "Midday of 10 Sep 2024 (article 13:00 ICT)",
     "th": "เที่ยงวันที่ 10 ก.ย. 2567 (2024) (ข่าวเวลา 13:00 น.)"
    },
    "window_start": "2024-09-10T00:00:00+07:00",
    "window_end": "2024-09-10T13:00:00+07:00",
    "window_basis": "The window runs from the start of the day the report describes to the article's time stamp."
   },
   "event_date_basis": "Article dated 10 Sep 2024 13:00, describing the situation that day.",
   "source": {
    "title": "เปิดภาพ อ.แม่สาย อ่วม ฝนตกหนักต่อเนื่อง น้ำท่วมตลาดสายลมจอย",
    "publisher": "Thai PBS",
    "url": "https://www.thaipbs.or.th/news/content/344023",
    "published": "2024-09-10T13:00:00+07:00",
    "language": "th"
   },
   "checker_corrections": ""
  },
  {
   "id": "ms-c2-04",
   "statement_id": "ms-c2-04",
   "place": {
    "en": "Sai Lom Joy market (a building in the market)",
    "th": "ตลาดสายลมจอย (อาคารหนึ่งในตลาด)"
   },
   "tambon": {
    "en": "Wiang Phang Kham",
    "th": "เวียงพางคำ"
   },
   "tambon_note": null,
   "point": null,
   "location_confidence": "low",
   "location_tolerance_m": null,
   "location_basis": "The appeal names only Sai Lom Joy; the building is unknown, so no point is given.",
   "depth": {
    "kind": "class",
    "lower_bound_m": null,
    "upper_m": null,
    "class": "roof_level_refuge",
    "statement": {